question,answer
"What is your quality assurance process?","Our QA process follows these steps: 1) Requirements Analysis: Understanding and documenting test requirements, 2) Test Planning: Creating comprehensive test strategies and plans, 3) Test Design: Developing detailed test cases and scenarios, 4) Test Environment Setup: Configuring and maintaining test environments, 5) Test Execution: Running tests and documenting results, 6) Defect Management: Tracking and managing issues, 7) Reporting: Generating detailed test reports and metrics."
"How do you manage testing projects?","Our project management approach includes: 1) Project Initiation: Scope definition and resource planning, 2) Sprint Planning: Agile methodology implementation, 3) Daily Standups: Regular team communication, 4) Progress Tracking: Using JIRA and other tools, 5) Risk Management: Proactive risk identification and mitigation, 6) Quality Gates: Defined entry/exit criteria, 7) Client Communication: Regular updates and feedback sessions."
"What is your defect management process?","Our defect management process involves: 1) Defect Detection: Through various testing methods, 2) Defect Logging: Detailed bug reports with steps to reproduce, 3) Defect Prioritization: Based on severity and impact, 4) Defect Assignment: To appropriate team members, 5) Defect Tracking: Using JIRA or similar tools, 6) Verification: Retesting fixed issues, 7) Metrics: Defect trending and analysis."
"How do you handle test environment management?","Our test environment management includes: 1) Environment Setup: Creating and configuring test environments, 2) Configuration Management: Version control and tracking, 3) Data Management: Test data creation and maintenance, 4) Access Control: Security and permissions management, 5) Maintenance: Regular updates and cleanup, 6) Monitoring: Environment health checks, 7) Documentation: Environment specifications and procedures."
"What is your test data management approach?","We manage test data through: 1) Data Generation: Creating synthetic test data, 2) Data Security: Implementing data protection measures, 3) Data Versioning: Maintaining different data sets, 4) Data Refresh: Regular updates of test data, 5) Data Cleanup: Removing obsolete test data, 6) Data Compliance: Ensuring regulatory compliance, 7) Data Documentation: Maintaining data dictionaries."
"How do you ensure process improvement?","Our process improvement approach includes: 1) Metrics Collection: Gathering performance data, 2) Analysis: Identifying improvement areas, 3) Feedback Loop: Incorporating team and client feedback, 4) Best Practices: Implementing industry standards, 5) Tool Evaluation: Regular assessment of new tools, 6) Training: Continuous team upskilling, 7) Innovation: Adopting new technologies and methods."
"What is your release management process?","Our release management process involves: 1) Release Planning: Defining release scope and schedule, 2) Build Management: Version control and build creation, 3) Deployment Planning: Preparing deployment strategies, 4) Testing Cycles: Regression and release testing, 5) Sign-off: Stakeholder approval process, 6) Deployment: Controlled release process, 7) Post-Release: Monitoring and support."
"How do you handle test automation processes?","Our test automation process includes: 1) Framework Design: Creating robust automation frameworks, 2) Script Development: Writing and reviewing test scripts, 3) Version Control: Managing automation code, 4) Execution: Scheduled and triggered runs, 5) Maintenance: Regular updates and optimization, 6) Reporting: Automated test results, 7) Integration: CI/CD pipeline integration."
"What is your documentation process?","We maintain comprehensive documentation including: 1) Test Plans: Detailed testing strategies, 2) Test Cases: Step-by-step test procedures, 3) Test Reports: Execution results and metrics, 4) Process Guides: Standard operating procedures, 5) Technical Docs: Tool and framework documentation, 6) Training Materials: Team training resources, 7) Client Documents: Project-specific documentation."
"How do you manage test metrics?","Our test metrics management includes: 1) Metric Definition: Identifying key performance indicators, 2) Data Collection: Gathering testing metrics, 3) Analysis: Interpreting metric data, 4) Reporting: Regular metric reports, 5) Trending: Historical analysis and forecasting, 6) Action Items: Improvement recommendations, 7) Dashboard: Real-time metric visualization."
"What is your change management process?","Our change management process involves: 1) Change Request: Documenting proposed changes, 2) Impact Analysis: Assessing change effects, 3) Approval Process: Getting stakeholder sign-off, 4) Implementation: Executing approved changes, 5) Testing: Verifying change results, 6) Documentation: Updating relevant docs, 7) Communication: Informing stakeholders."
"How do you handle risk management?","Our risk management approach includes: 1) Risk Identification: Proactive risk detection, 2) Risk Assessment: Evaluating impact and probability, 3) Risk Mitigation: Developing prevention strategies, 4) Risk Monitoring: Continuous risk tracking, 5) Contingency Planning: Backup plans for key risks, 6) Risk Communication: Stakeholder updates, 7) Risk Review: Regular risk reassessment."
"What is your knowledge management process?","We manage knowledge through: 1) Documentation: Maintaining knowledge base, 2) Training: Regular knowledge sharing sessions, 3) Mentoring: Senior-junior knowledge transfer, 4) Tools: Knowledge management systems, 5) Best Practices: Documenting learned lessons, 6) Updates: Regular content reviews, 7) Access: Easy information retrieval."
"How do you ensure process compliance?","We ensure compliance through: 1) Standards: Following industry standards, 2) Audits: Regular process audits, 3) Reviews: Periodic process reviews, 4) Training: Compliance training, 5) Monitoring: Continuous compliance checking, 6) Reporting: Compliance status reports, 7) Updates: Regular process updates."