question,answer
"What is your technical testing approach?","Our technical testing framework includes: 1) Unit Testing: Code-level testing using JUnit, TestNG, NUnit, 2) Integration Testing: API testing, service integration, database testing, 3) System Testing: End-to-end functionality verification, 4) Performance Testing: Load, stress, and scalability testing, 5) Security Testing: Vulnerability assessment and penetration testing, 6) Automation Testing: Continuous integration and regression testing."
"How do you handle performance testing?","Our performance testing process includes: 1) Load Testing: Simulating multiple users and transactions, 2) Stress Testing: Testing system limits and breaking points, 3) Scalability Testing: Verifying system scaling capabilities, 4) Endurance Testing: Long-duration performance verification, 5) Spike Testing: Sudden load increase testing, 6) Tools Used: JMeter, Gatling, K6, LoadRunner, 7) Monitoring: Real-time performance metrics and analysis."
"What is your mobile testing strategy?","Our mobile testing strategy covers: 1) Functional Testing: App functionality, UI/UX, navigation, 2) Compatibility Testing: Multiple devices, OS versions, screen sizes, 3) Performance Testing: App speed, resource usage, battery impact, 4) Security Testing: Data protection, authentication, 5) Network Testing: Different connection types, offline functionality, 6) Tools: Appium, XCUITest, Espresso, BrowserStack, 7) Real Device Lab: Physical and virtual device testing."
"How do you implement test automation?","Our test automation implementation includes: 1) Framework Selection: Based on project needs (Selenium, Cypress, Playwright), 2) Script Development: Using Python, Java, JavaScript, C#, 3) CI/CD Integration: Jenkins, GitLab CI, GitHub Actions, 4) Cross-browser Testing: Chrome, Firefox, Safari, Edge, 5) Reporting: Automated test reports and dashboards, 6) Maintenance: Regular updates and optimization."
"What security testing methods do you use?","Our security testing methods include: 1) Vulnerability Scanning: Using industry-standard tools, 2) Penetration Testing: Manual and automated security testing, 3) Security Compliance: OWASP Top 10, SANS 25, 4) API Security: Authentication, authorization testing, 5) Data Security: Encryption, secure transmission testing, 6) Security Monitoring: Continuous security assessment."
"How do you handle API testing?","Our API testing approach covers: 1) Functional Testing: Endpoint validation, request/response verification, 2) Security Testing: Authentication, authorization, encryption, 3) Performance Testing: Response time, throughput testing, 4) Integration Testing: Third-party API integration, 5) Documentation Testing: Swagger/OpenAPI validation, 6) Tools: Postman, SoapUI, REST Assured."
"What is your DevOps testing approach?","Our DevOps testing includes: 1) Continuous Integration: Automated build and test processes, 2) Continuous Deployment: Automated deployment testing, 3) Infrastructure Testing: Configuration and environment testing, 4) Container Testing: Docker, Kubernetes validation, 5) Microservices Testing: Service mesh testing, 6) Monitoring: Application and infrastructure monitoring."
"How do you ensure test coverage?","We ensure comprehensive test coverage through: 1) Code Coverage: Unit test coverage metrics, 2) Functional Coverage: Feature and requirement coverage, 3) Risk-Based Coverage: Critical path testing, 4) UI Coverage: All user interface elements, 5) Data Coverage: Test data combinations, 6) Tools: JaCoCo, Cobertura, SonarQube, 7) Regular Coverage Analysis and Reporting."
"What is your database testing approach?","Our database testing includes: 1) Data Integrity Testing: CRUD operations validation, 2) Performance Testing: Query optimization, load testing, 3) Security Testing: Access control, encryption testing, 4) Migration Testing: Data migration validation, 5) Backup/Recovery Testing: Data backup and restore testing, 6) Tools: SQL, MongoDB, Oracle testing tools."
"How do you handle cloud testing?","Our cloud testing approach covers: 1) AWS Testing: EC2, S3, Lambda testing, 2) Azure Testing: Azure services validation, 3) Google Cloud Testing: GCP services testing, 4) Cloud Security Testing: Cloud security controls, 5) Performance Testing: Cloud scalability testing, 6) Cost Optimization: Resource utilization testing."
"What tools do you use for test management?","We use comprehensive test management tools: 1) JIRA: Issue tracking and project management, 2) TestRail: Test case management and execution, 3) qTest: Test planning and reporting, 4) Zephyr: Agile test management, 5) Azure DevOps: Integrated test management, 6) Custom Tools: Internal test management solutions."
"How do you handle regression testing?","Our regression testing approach includes: 1) Automated Regression Suites: Regular execution of core tests, 2) Risk-Based Selection: Prioritized test cases, 3) Continuous Integration: Automated regression in CI/CD, 4) Impact Analysis: Change-based test selection, 5) Parallel Execution: Distributed test execution, 6) Regular Maintenance: Test suite optimization."
"What is your approach to accessibility testing?","Our accessibility testing covers: 1) WCAG 2.1 Compliance: A, AA, AAA levels, 2) Screen Reader Testing: NVDA, JAWS compatibility, 3) Keyboard Navigation: Full keyboard accessibility, 4) Color Contrast: Visual accessibility testing, 5) Tools: aXe, WAVE, Lighthouse, 6) Regular Accessibility Audits."
"How do you handle cross-browser testing?","Our cross-browser testing includes: 1) Browser Coverage: All major browsers and versions, 2) Responsive Design Testing: Different screen sizes and resolutions, 3) Automated Testing: Selenium Grid, BrowserStack integration, 4) Visual Testing: Layout and rendering verification, 5) Performance Testing: Browser-specific performance, 6) Regular Browser Matrix Updates."